<?xml version='1.0' encoding='utf-8' ?>
<config version='1.0'
xmlns:xsi="http://www.w3.org/2001/XMLSchema-instance"
xsi:noNamespaceSchemaLocation="config.xsd" >
    <!--
    # ===========================================================================
    # Copyright (C) 2014  Gerhard Hepp
    #
    # This program is free software; you can redistribute it and/or modify it under the terms of
    # the GNU General Public License as published by the Free Software Foundation; either version 2
    # of the License, or (at your option) any later version.
    #
    # This program is distributed in the hope that it will be useful, but WITHOUT ANY WARRANTY;
    # without even the implied warranty of MERCHANTABILITY or FITNESS FOR A PARTICULAR PURPOSE.
    # See the GNU General Public License for more details.
    #
    # You should have received a copy of the GNU General Public License along with this program; if
    # not, write to the Free Software Foundation, Inc., 51 Franklin St, Fifth Floor, Boston,
    # MA 02110, USA
    # ===========================================================================
    -->
    <description>Air pressure and temparature.</description>

    <!-- =========================================================================== -->
    <adapter class='adapter.i2cAdapter.Pressure_BMP085_Input'  name='pressure'>
        <description>Pressure-Value from BMP085
        Connected to I2C-Bus.
        </description>
        
        <output_value name='pressure'>
            <sensor name='pressure'/>
        </output_value>

        <output_value name='temperature'>
            <sensor name='temperature'/>
        </output_value>
        
        <parameter name='poll.interval' value='2.5' />
       
        <!-- bus is '1' for RPi Release 2 -->
        <parameter name='i2c.bus' value='1' />
        
        <!-- Depending on address select, the bus address is 
             '0x77' for BMP085 
             
             -->
        <parameter name='i2c.address' value='0x77' />
    </adapter>

</config>
