<?xml version='1.0' encoding='utf-8' ?>
<config version='1.0'
xmlns:xsi="http://www.w3.org/2001/XMLSchema-instance"
xsi:noNamespaceSchemaLocation="config.xsd" >
    <!--
    # ===========================================================================
    # Copyright (C) 2014  Gerhard Hepp
    #
    # This program is free software; you can redistribute it and/or modify it under the terms of
    # the GNU General Public License as published by the Free Software Foundation; either version 2
    # of the License, or (at your option) any later version.
    #
    # This program is distributed in the hope that it will be useful, but WITHOUT ANY WARRANTY;
    # without even the implied warranty of MERCHANTABILITY or FITNESS FOR A PARTICULAR PURPOSE.
    # See the GNU General Public License for more details.
    #
    # You should have received a copy of the GNU General Public License along with this program; if
    # not, write to the Free Software Foundation, Inc., 51 Franklin St, Fifth Floor, Boston,
    # MA 02110, USA
    # ===========================================================================
    -->
    <description>Temperature in degree Celsius; Humidity in Percent.</description>

    <!-- =========================================================================== -->
    <adapter class='adapter.atmel328_adapter.Atmel328_DHT22_Adapter'  name='dht22'>
        
        <description>dht22</description>
        
        <output_value name='humidity'>
            <sensor name='humidity_A'/>
        </output_value>
        
        <output_value name='temperature'>
            <sensor name='temperature_A'/>
        </output_value>
        
        <input name= 'led_on'>
            <broadcast name='led_on'/>
        </input>   
           
        <input name= 'led_off'>
            <broadcast name='led_off'/>
        </input>
        
        <!-- although not actively used, this is needed to handle reset line -->
        <gpio port='GPIO24'>
            <default dir='OUT'  default='low' />
            <active  dir='OUT'  default='high' />
        </gpio>

        <!-- polling time for external device -->
        <parameter name='poll.interval' value='5.0' />
        
        <!-- DHT22, DHT11  -->
        <parameter name='sensor.device' value='DHT22' />

       
        <parameter name='spi.bus' value='0' />
        <parameter name='spi.device' value='0' />
    </adapter>

</config>
