<?xml version='1.0' encoding='utf-8' ?>
<config version='1.0'
	xmlns:xsi="http://www.w3.org/2001/XMLSchema-instance"
	xsi:noNamespaceSchemaLocation="config.xsd" >
	<!--
	# ===========================================================================
	# Copyright (C) 2013  Gerhard Hepp
	#
	# This program is free software; you can redistribute it and/or modify it under the terms of
	# the GNU General Public License as published by the Free Software Foundation; either version 2
	# of the License, or (at your option) any later version.
	#
	# This program is distributed in the hope that it will be useful, but WITHOUT ANY WARRANTY;
	# without even the implied warranty of MERCHANTABILITY or FITNESS FOR A PARTICULAR PURPOSE.
	# See the GNU General Public License for more details.
	#
	# You should have received a copy of the GNU General Public License along with this program; if
	# not, write to the Free Software Foundation, Inc., 51 Franklin St, Fifth Floor, Boston,
	# MA 02110, USA
	# ===========================================================================
	-->
	<description>
		Dial Plate with two contacts
		   nsa: closed during dial plate movements
		   nsi: pulse contact
		
		Pullup are needed, as provided on IKG-Adapter.
		With N=6 'teeth', the resolution is 30 degree.

		Jumper: 
			gesetzt:
               in.0 bis in.7 
            offen:
			   out.0 bis out.7
               out2.0 bis out2.7 

	</description>

	<!-- =========================================================================== -->
	<adapter class='adapter.encoder.GPIODialPlateEncoder'  name='dial_A'>
		<description>Wè¾°hlscheibe.
		Anschluss: NSI (Impuls) 
		           NSA (Drehschalter)
		</description>

		<gpio port='IKG.IO.1' alias='nsi'>
			<default dir='IN' pull='PUD_UP'  />
			<active dir='IN' pull='PUD_UP'   />
		</gpio>
		<gpio port='IKG.IO.3' alias='nsa'>
			<default dir='IN' pull='PUD_UP'  />
			<active dir='IN' pull='PUD_UP'   />
		</gpio>

		<output_value name='number'>
			<sensor name='numberA'/>
		</output_value>
		
	</adapter>

</config>
