<?xml version='1.0' encoding='utf-8' ?>
<config version='1.0'
	xmlns:xsi="http://www.w3.org/2001/XMLSchema-instance"
	xsi:noNamespaceSchemaLocation="config.xsd" >
	<!--
	# ===========================================================================
	# Copyright (C) 2013  Gerhard Hepp
	#
	# This program is free software; you can redistribute it and/or modify it under the terms of
	# the GNU General Public License as published by the Free Software Foundation; either version 2
	# of the License, or (at your option) any later version.
	#
	# This program is distributed in the hope that it will be useful, but WITHOUT ANY WARRANTY;
	# without even the implied warranty of MERCHANTABILITY or FITNESS FOR A PARTICULAR PURPOSE.
	# See the GNU General Public License for more details.
	#
	# You should have received a copy of the GNU General Public License along with this program; if
	# not, write to the Free Software Foundation, Inc., 51 Franklin St, Fifth Floor, Boston,
	# MA 02110, USA
	# ===========================================================================
	-->

	<description>Sample remote communication configuration</description>

	<!-- =========================================================================== -->
	<adapter class='adapter.remote.CommunicationAdapter' name='communication_adapter'>
		
		<!-- Adapter uses native Syntax -->
		
		<description>Remote communication adapter. </description>

        <!--  these commands are received from scratch and forwarded to a remote attached scratchClient -->
		<remote type='forward'>
 		
         	<broadcast name='command_A'/>  
		</remote>

        <!--  these commands are received from a remote attached scratchClient and sent to local scratch -->
		<remote type='receive'>
            <broadcast name='command_B'/>
		</remote>

        <parameter name="group" value="groupA"  />
        <parameter name="server" value="192.168.2.108" />

	</adapter>

    
</config>
