<?xml version='1.0' encoding='utf-8' ?>
<config version='1.0'
xmlns:xsi="http://www.w3.org/2001/XMLSchema-instance"
xsi:noNamespaceSchemaLocation="config.xsd" >
	<!--
	# ===========================================================================
	# Copyright (C) 2017  Gerhard Hepp
	#
	# This program is free software; you can redistribute it and/or modify it under the terms of
	# the GNU General Public License as published by the Free Software Foundation; either version 2
	# of the License, or (at your option) any later version.
	#
	# This program is distributed in the hope that it will be useful, but WITHOUT ANY WARRANTY;
	# without even the implied warranty of MERCHANTABILITY or FITNESS FOR A PARTICULAR PURPOSE.
	# See the GNU General Public License for more details.
	#
	# You should have received a copy of the GNU General Public License along with this program; if
	# not, write to the Free Software Foundation, Inc., 51 Franklin St, Fifth Floor, Boston,
	# MA 02110, USA
	# ===========================================================================
	-->
	<description>DHT11, DHT22.</description>

	<!-- =========================================================================== -->
	<adapter class='adapter.pigpiodAdapter.Pigpiod_DHT11_Adapter'  name='dht11'>
		<description>Sample GPIO PWM</description>
		<gpio port='GPIO23'>
			<default dir='IN' pull='PUD_OFF'  />
			<active dir='RESERVED' />
		</gpio>
		
        <output_value name='temperature'>
            <sensor name='temperature'/>
        </output_value>
        <output_value name='humidity'>
            <sensor name='humidity'/>
        </output_value>
        
	</adapter>
	
</config>
