<?xml version='1.0' encoding='utf-8' ?>
<config version='1.0'
	xmlns:xsi="http://www.w3.org/2001/XMLSchema-instance"
	xsi:noNamespaceSchemaLocation="config.xsd" >
	<!--
	# ===========================================================================
	# Copyright (C) 2014  Gerhard Hepp
	#
	# This program is free software; you can redistribute it and/or modify it under the terms of
	# the GNU General Public License as published by the Free Software Foundation; either version 2
	# of the License, or (at your option) any later version.
	#
	# This program is distributed in the hope that it will be useful, but WITHOUT ANY WARRANTY;
	# without even the implied warranty of MERCHANTABILITY or FITNESS FOR A PARTICULAR PURPOSE.
	# See the GNU General Public License for more details.
	#
	# You should have received a copy of the GNU General Public License along with this program; if
	# not, write to the Free Software Foundation, Inc., 51 Franklin St, Fifth Floor, Boston,
	# MA 02110, USA
	# ===========================================================================
	-->

	<description>
		Arbeitskreis Physical Computing am IKG.
		Ansteuerung einer RGB mit PWM, 2 ADC-Kanテ、le und 1 Taster.
		Die Ansteuerung der LED wird 'rgb_A_R', 'rgb_A_G', 'rgb_A_B' fテシr scratch bezeichnet, 0..100.
		
		Jumper: 
			gesetzt:
			    out.0, 1, 2 gesetzt.
			    in.3 gesetzt.
            offen:
               in.4 bis in.7 
               out2.0 bis out2.7 
        Vorsicht: Frequenz muss immer auf 50 sein !
    </description>
    
	<!-- =========================================================================== -->
	<adapter class='adapter.gpio.GpioOutputPWM'  name='rgb_A_G'>
		<description>RGB_A, GRテ廸</description>

		<gpio port='GPIO25'>
			<default dir='OUT'  default='high' />
			<active  dir='OUT'  default='low' />
		</gpio>
		
		<input_value name='rate'>
			<variable name='rgb_A_G'/>
		</input_value>
		
		<parameter name='frequency' value='50' />
		<parameter name='rate' value='90' />

	</adapter>
	<adapter class='adapter.gpio.GpioOutputPWM'  name='rgb_A_R'>
		<description>RGB_A, ROT</description>

		<gpio port='GPIO24'>
			<default dir='OUT'  default='high' />
			<active  dir='OUT'  default='low' />
		</gpio>
		
		<input_value name='rate'>
			<variable name='rgb_A_R'/>
		</input_value>
		
		<parameter name='frequency' value='50' />
		<parameter name='rate' value='90' />

	</adapter>
	<adapter class='adapter.gpio.GpioOutputPWM'  name='rgb_A_B'>
		<description>RGB_A, Blau</description>

		<gpio port='GPIO23'>
			<default dir='OUT'  default='high' />
			<active  dir='OUT'  default='low' />
		</gpio>
		
		<input_value name='rate'>
			<variable name='rgb_A_B'/>
		</input_value>
		
		<parameter name='frequency' value='50' />
		<parameter name='rate' value='90' />

	</adapter>
    <adapter class='adapter.adc.ADCInput'  name='adc_A'>
        <description>ADC-Value</description>
        <output_value name='adc'>
            <sensor name='adcA'/>
        </output_value>
        <parameter name='poll.interval' value='0.066' />
        <parameter name='spi.bus' value='0' />
        <parameter name='spi.device' value='0' />
        <parameter name='adc.channel' value='0' />
    </adapter>
    
    <adapter class='adapter.adc.ADCInput'  name='adc_B'>
        <description>ADC-Value</description>
        <output_value name='adc'>
            <sensor name='adcB'/>
        </output_value>
        <parameter name='poll.interval' value='0.066' />
        <parameter name='spi.bus' value='0' />
        <parameter name='spi.device' value='0' />
        <parameter name='adc.channel' value='1' />

    </adapter>
    <!-- =========================================================================== -->
    <adapter class='adapter.gpio.GpioEventInput' name='button_s3'>
        
        
        <gpio port='IKG.IO.3'>
            <default dir='IN' pull='PUD_UP'  />
            <active dir='IN' pull='PUD_UP'/>
        </gpio>
        
        <output name='button_pressed'>
            <broadcast name='s3_pressed'/>
        </output>
        <output name='button_released'>
            <broadcast name='s3_released'/>
        </output>
        
        <parameter name='poll.interval' value='0.066' />
        <parameter name='value.inverse' value='true' />

    </adapter>

    <adapter class='adapter.gpio.GpioStateOutput'  name='state'>
        <description>State display on IKG.IO.9</description>

        <gpio port='IKG.IO.9' alias='state'>
            <default dir='OUT'  default='low' />
            <active  dir='OUT'  default='low' />
        </gpio>
    </adapter>

</config>
